{
  "$schema": "https://json-schema.org/draft/2020-12/schema",
  "$id": "scene-composition-manifest-v1.schema.json",
  "title": "SceneCompositionManifestV1",
  "type": "object",
  "required": [
    "sceneCompositionManifestVersion",
    "metadata",
    "entryScene",
    "scenes"
  ],
  "properties": {
    "sceneCompositionManifestVersion": {
      "enum": [1]
    },
    "metadata": {
      "type": "object",
      "required": ["name"],
      "properties": {
        "name": {
          "type": "string",
          "minLength": 1
        }
      },
      "additionalProperties": false
    },
    "entryScene": {
      "type": "string",
      "minLength": 1
    },
    "scenes": {
      "type": "array",
      "minItems": 1,
      "items": {
        "type": "object",
        "required": [
          "ref",
          "path"
        ],
        "properties": {
          "ref": {
            "type": "string",
            "minLength": 1
          },
          "path": {
            "type": "string",
            "minLength": 1
          }
        },
        "additionalProperties": false
      }
    }
  },
  "additionalProperties": false
}
